<?xml version="1.0"?>
<!DOCTYPE Report
[
<!ELEMENT Report (General ,(Doc|BPT)) >
<!ATTLIST Report ver CDATA #REQUIRED tmZone CDATA #REQUIRED>

<!ELEMENT General ( DocLocation ) >
<!ATTLIST General productName CDATA #REQUIRED productVer CDATA #REQUIRED os CDATA #REQUIRED host CDATA #REQUIRED qcserver CDATA #IMPLIED qcproject CDATA #IMPLIED SolManSolutionId CDATA #IMPLIED SolManProjectId CDATA #IMPLIED SolManTestPlanId CDATA #IMPLIED SolManTestPackageId CDATA #IMPLIED SolManUserInfoData CDATA #IMPLIED  >

<!ELEMENT BPT (DName,Res,DVer?,TSet?,TInst?,NodeArgs,AdditionalInfo*,Doc*) >
<!ATTLIST BPT rID ID #REQUIRED >

<!ELEMENT Doc (DName,ConfName?,Res,DVer?,TSet?,TInst?,RunType?,DT?,AdditionalInfo*,Step*,DIter*,Step*,Action*,Doc*,Summary?,TestMaintenanceSummary*,NodeArgs?) >
<!ATTLIST Doc rID ID #REQUIRED type (Test|BC|BPTWrapperTest|Flow|Group|Action) "Test" productName CDATA #REQUIRED BCIter CDATA #IMPLIED >

<!ELEMENT RunType ( #PCDATA )>
<!ATTLIST RunType fmStep (False|True) "False" batch (False|True) "False" upDesc (False|True) "False" upChk (False|True) "False" upAS (False|True) "False">

<!ELEMENT DName ( #PCDATA ) >

<!ELEMENT ConfName ( #PCDATA ) >

<!ELEMENT Res ( #PCDATA ) >

<!ELEMENT AdditionalInfo (AdditionalDataName,AdditionalDataValue ) >

<!ELEMENT AdditionalDataName ( #PCDATA ) >

<!ELEMENT AdditionalDataValue ( #PCDATA ) >

<!ELEMENT DVer ( #PCDATA ) >

<!ELEMENT TSet ( #PCDATA ) >

<!ELEMENT TInst ( #PCDATA ) >

<!ELEMENT DIter (Step*,Action+,Summary?,NodeArgs)>
<!ATTLIST DIter rID ID #REQUIRED iterID CDATA #REQUIRED>

<!ELEMENT DocLocation ( #PCDATA )>

<!ELEMENT Action (AName,AIter*,(Step|HtmlStep|Action)*, Summary,ActionMaintenanceSummary*, NodeArgs ) >
<!ATTLIST Action rID ID #REQUIRED>

<!ELEMENT AIter ((Step|HtmlStep|Action)*,DataMapping?, Summary?,NodeArgs) >
<!ATTLIST AIter rID ID #REQUIRED iterID CDATA #REQUIRED isCountable (False|True) "False" >

<!ELEMENT AName ( #PCDATA ) >

<!ELEMENT TestMaintenanceSummary (ActionMaintenanceSummary*) >
<!ATTLIST TestMaintenanceSummary ObjectsAdded CDATA #REQUIRED ObjectsUpdated CDATA #REQUIRED StepsUpdated CDATA #REQUIRED StepsComments CDATA #REQUIRED><!ELEMENT ActionMaintenanceSummary (ObjectChange* ) >
<!ATTLIST ActionMaintenanceSummary Action CDATA #REQUIRED Objects CDATA #REQUIRED Updated CDATA #REQUIRED LinesTotal CDATA #REQUIRED Added CDATA #REQUIRED LinesUpdated CDATA #REQUIRED>

<!ELEMENT ObjectChange  (Hierarchy, PropertyChangeList* ) >
<!ATTLIST ObjectChange Operation CDATA #IMPLIED OriginalRepository CDATA #IMPLIED>

<!ELEMENT PropertyChangeList (PropertyDef*) >

<!ELEMENT PropertyDef (OriginalValue, NewValue) >
<!ATTLIST PropertyDef PropName CDATA #REQUIRED OriginRegularExpression (True|False) "False" NewRegularExpression (True|False) "False" AddedProperty (True|False) "False" >

<!ELEMENT OriginalValue ( #PCDATA )>

<!ELEMENT NewValue ( #PCDATA )>

<!ELEMENT Hierarchy  (ObjectName, Hierarchy*) >
<!ATTLIST Hierarchy MicClass CDATA #REQUIRED>

<!ELEMENT ObjectName  ( #PCDATA ) >

<!ELEMENT Step (Obj,Details,Time,TimeTick* ,(Step|HtmlStep|Doc)*, DataMapping?, NodeArgs) >
<!ATTLIST Step rID ID #REQUIRED retval CDATA #IMPLIED>

<!ELEMENT HtmlStep (HTML,TimeTick*,(Step|HtmlStep|Doc)*,NodeArgs) >
<!ATTLIST HtmlStep rID ID #REQUIRED >

<!ELEMENT Obj ( #PCDATA ) >
<!ATTLIST Obj plainTxt (False|True) "True">

<!ELEMENT Details ( #PCDATA ) >
<!ATTLIST Details plainTxt (False|True) "True">

<!ELEMENT Time ( #PCDATA ) >

<!ELEMENT HTML ( #PCDATA ) >

<!ELEMENT Disp ( #PCDATA ) >

<!ELEMENT TimeTick ( #PCDATA ) >

<!ELEMENT DataMapping ( DataMappedItem* )>
<!ELEMENT DataMappedItem EMPTY >
<!ATTLIST DataMappedItem dsName CDATA #REQUIRED >
<!ATTLIST DataMappedItem rowId CDATA #REQUIRED >

<!ELEMENT NodeArgs (Disp,TopPane?,BtmPane?,ExtendedInfo? )>
<!ATTLIST NodeArgs eType CDATA #REQUIRED icon CDATA #REQUIRED nRep CDATA #REQUIRED UserNote CDATA #IMPLIED filter (False|True) "True">
<!ATTLIST NodeArgs status (Passed|Failed|Done|Warning|Information) "Done">
<!ATTLIST NodeArgs iconSel CDATA #IMPLIED nType CDATA #IMPLIED MovieMarker CDATA "">
<!ATTLIST NodeArgs Source CDATA #IMPLIED SourceLine CDATA #IMPLIED StepFlowItemKey CDATA #IMPLIED >

<!ELEMENT TopPane (Path)>

<!ELEMENT BtmPane ( (Path|WR)?,ASHilite?)>
<!ATTLIST BtmPane vType CDATA "HTML">

<!ELEMENT Path ( #PCDATA ) >

<!ELEMENT ASHilite ( #PCDATA ) >

<!ELEMENT WR ( #PCDATA ) >

<!ELEMENT ExtendedInfo ( StepData ) >

<!ATTLIST ExtendedInfo StepType CDATA #REQUIRED>
<!ELEMENT DT (NodeArgs) >
<!ATTLIST DT rID ID #REQUIRED>

<!ELEMENT Summary (Param*)>
<!ATTLIST Summary sTime CDATA #IMPLIED eTime CDATA #IMPLIED passed CDATA #IMPLIED failed CDATA #IMPLIED warnings CDATA #IMPLIED retval CDATA #IMPLIED stopped (False|True) "False" >

<!ELEMENT Param (ParamName,ParamVal)+ >
<!ATTLIST Param paramInOut (In|Out) "In">

<!ELEMENT ParamName ( #PCDATA ) >

<!ELEMENT ParamVal ( #PCDATA ) >

]
>
<Report ver="2.0" tmZone="India Standard Time">
<General productName="HP Unified Functional Testing" productVer="12.01" os="Windows 7" host="HW2314"><DocLocation><![CDATA[C:\IFSAutomation\Trunk_IFS_QuestionTypes\Drivers\SuiteDriver]]></DocLocation></General>
<Doc rID="T1"   productName= "HP Unified Functional Testing"  >
<DName><![CDATA[SuiteDriver]]></DName>
<Res><![CDATA[Res385]]></Res>
<DT rID="T2">
<NodeArgs eType="Table" icon="2" nRep="4" filter="False" >
<Disp><![CDATA[Run-Time Data Table]]></Disp>
<BtmPane vType="Table" >
<Path><![CDATA[Default.xls]]></Path>
</BtmPane>
</NodeArgs>
</DT>
<Action rID="T3">
<AName><![CDATA[Action1]]></AName>
<Step rID="T4">
<Obj plainTxt="False" ><![CDATA[SystemUtil]]></Obj>
<Details plainTxt="False" ><![CDATA[SystemUtil]]></Details>
<Time><![CDATA[13-05-2016 - 14:27:36]]></Time>
<TimeTick>1463129856</TimeTick>
<Step rID="T5">
<Obj plainTxt="False" ><![CDATA[Run "iexplore.exe",3]]></Obj>
<Details plainTxt="False" ><![CDATA[Run "iexplore.exe",3]]></Details>
<Time><![CDATA[13-05-2016 - 14:27:36]]></Time>
<TimeTick>1463129856</TimeTick>
<NodeArgs eType="Replay" icon="4" nRep="10" status="Passed" >
<Disp><![CDATA[Run "iexplore.exe",3]]></Disp>
</NodeArgs>
</Step>
<NodeArgs eType="Replay" icon="4" nRep="9" status="Passed" >
<Disp><![CDATA[SystemUtil]]></Disp>
</NodeArgs>
</Step>
<Step rID="T6">
<Obj plainTxt="False" ><![CDATA[Login]]></Obj>
<Details plainTxt="False" ><![CDATA[Browser]]></Details>
<Time><![CDATA[13-05-2016 - 14:27:46]]></Time>
<TimeTick>1463129866</TimeTick>
<Step rID="T7">
<Obj plainTxt="False" ><![CDATA[Login]]></Obj>
<Details plainTxt="False" ><![CDATA[Page]]></Details>
<Time><![CDATA[13-05-2016 - 14:27:46]]></Time>
<TimeTick>1463129866</TimeTick>
<Step rID="T8">
<Obj plainTxt="False" ><![CDATA[Login.Sync]]></Obj>
<Details plainTxt="False" ><![CDATA[]]></Details>
<Time><![CDATA[13-05-2016 - 14:27:46]]></Time>
<TimeTick>1463129866</TimeTick>
<NodeArgs eType="Replay" icon="6" nRep="15" >
<Disp><![CDATA[Login.Sync]]></Disp>
</NodeArgs>
</Step>
<NodeArgs eType="Context" icon="6" nRep="14" >
<Disp><![CDATA[Login]]></Disp>
</NodeArgs>
</Step>
<NodeArgs eType="Context" icon="5" nRep="13" >
<Disp><![CDATA[Login]]></Disp>
</NodeArgs>
</Step>
<Step rID="T9">
<Obj ><![CDATA[Login]]></Obj>
<Details ><![CDATA[]]></Details>
<Time><![CDATA[13-05-2016 - 14:27:46]]></Time>
<TimeTick>1463129866</TimeTick>
<NodeArgs eType="User" icon="7" nRep="16" status="Passed" >
<Disp><![CDATA[Login]]></Disp>
</NodeArgs>
</Step>
<Step rID="T10">
<Obj plainTxt="False" ><![CDATA[Login]]></Obj>
<Details plainTxt="False" ><![CDATA[Browser]]></Details>
<Time><![CDATA[13-05-2016 - 14:27:46]]></Time>
<TimeTick>1463129866</TimeTick>
<Step rID="T11">
<Obj plainTxt="False" ><![CDATA[Login]]></Obj>
<Details plainTxt="False" ><![CDATA[Page]]></Details>
<Time><![CDATA[13-05-2016 - 14:27:46]]></Time>
<TimeTick>1463129866</TimeTick>
<Step rID="T12">
<Obj plainTxt="False" ><![CDATA[TXT_user_name.Exist]]></Obj>
<Details plainTxt="False" ><![CDATA["Object exists"]]></Details>
<Time><![CDATA[13-05-2016 - 14:27:46]]></Time>
<TimeTick>1463129866</TimeTick>
<NodeArgs eType="Replay" icon="8" nRep="20" >
<Disp><![CDATA[TXT_user_name.Exist]]></Disp>
</NodeArgs>
</Step>
<Step rID="T13">
<Obj plainTxt="False" ><![CDATA[TXT_user_name.Set]]></Obj>
<Details plainTxt="False" ><![CDATA["chrisj"]]></Details>
<Time><![CDATA[13-05-2016 - 14:27:46]]></Time>
<TimeTick>1463129866</TimeTick>
<NodeArgs eType="Replay" icon="8" nRep="22" >
<Disp><![CDATA[TXT_user_name.Set]]></Disp>
</NodeArgs>
</Step>
<NodeArgs eType="Context" icon="6" nRep="19" >
<Disp><![CDATA[Login]]></Disp>
</NodeArgs>
</Step>
<NodeArgs eType="Context" icon="5" nRep="18" >
<Disp><![CDATA[Login]]></Disp>
</NodeArgs>
</Step>
<Step rID="T14">
<Obj ><![CDATA[Login]]></Obj>
<Details ><![CDATA[]]></Details>
<Time><![CDATA[13-05-2016 - 14:27:46]]></Time>
<TimeTick>1463129866</TimeTick>
<NodeArgs eType="User" icon="7" nRep="23" status="Passed" >
<Disp><![CDATA[Login]]></Disp>
</NodeArgs>
</Step>
<Step rID="T15">
<Obj plainTxt="False" ><![CDATA[Login]]></Obj>
<Details plainTxt="False" ><![CDATA[Browser]]></Details>
<Time><![CDATA[13-05-2016 - 14:27:46]]></Time>
<TimeTick>1463129866</TimeTick>
<Step rID="T16">
<Obj plainTxt="False" ><![CDATA[Login]]></Obj>
<Details plainTxt="False" ><![CDATA[Page]]></Details>
<Time><![CDATA[13-05-2016 - 14:27:46]]></Time>
<TimeTick>1463129866</TimeTick>
<Step rID="T17">
<Obj plainTxt="False" ><![CDATA[TXT_user_password.Exist]]></Obj>
<Details plainTxt="False" ><![CDATA["Object exists"]]></Details>
<Time><![CDATA[13-05-2016 - 14:27:46]]></Time>
<TimeTick>1463129866</TimeTick>
<NodeArgs eType="Replay" icon="8" nRep="27" >
<Disp><![CDATA[TXT_user_password.Exist]]></Disp>
</NodeArgs>
</Step>
<Step rID="T18">
<Obj plainTxt="False" ><![CDATA[TXT_user_password.Set]]></Obj>
<Details plainTxt="False" ><![CDATA["password"]]></Details>
<Time><![CDATA[13-05-2016 - 14:27:46]]></Time>
<TimeTick>1463129866</TimeTick>
<NodeArgs eType="Replay" icon="8" nRep="29" >
<Disp><![CDATA[TXT_user_password.Set]]></Disp>
</NodeArgs>
</Step>
<NodeArgs eType="Context" icon="6" nRep="26" >
<Disp><![CDATA[Login]]></Disp>
</NodeArgs>
</Step>
<NodeArgs eType="Context" icon="5" nRep="25" >
<Disp><![CDATA[Login]]></Disp>
</NodeArgs>
</Step>
<Step rID="T19">
<Obj ><![CDATA[Login]]></Obj>
<Details ><![CDATA[]]></Details>
<Time><![CDATA[13-05-2016 - 14:27:46]]></Time>
<TimeTick>1463129866</TimeTick>
<NodeArgs eType="User" icon="7" nRep="30" status="Passed" >
<Disp><![CDATA[Login]]></Disp>
</NodeArgs>
</Step>
<Step rID="T20">
<Obj plainTxt="False" ><![CDATA[Login]]></Obj>
<Details plainTxt="False" ><![CDATA[Browser]]></Details>
<Time><![CDATA[13-05-2016 - 14:27:46]]></Time>
<TimeTick>1463129866</TimeTick>
<Step rID="T21">
<Obj plainTxt="False" ><![CDATA[Login]]></Obj>
<Details plainTxt="False" ><![CDATA[Page]]></Details>
<Time><![CDATA[13-05-2016 - 14:27:46]]></Time>
<TimeTick>1463129866</TimeTick>
<Step rID="T22">
<Obj plainTxt="False" ><![CDATA[BTN_Log In.Exist]]></Obj>
<Details plainTxt="False" ><![CDATA["Object exists"]]></Details>
<Time><![CDATA[13-05-2016 - 14:27:46]]></Time>
<TimeTick>1463129866</TimeTick>
<NodeArgs eType="Replay" icon="9" nRep="34" >
<Disp><![CDATA[BTN_Log In.Exist]]></Disp>
</NodeArgs>
</Step>
<Step rID="T23">
<Obj plainTxt="False" ><![CDATA[BTN_Log In.Click]]></Obj>
<Details plainTxt="False" ><![CDATA[]]></Details>
<Time><![CDATA[13-05-2016 - 14:27:46]]></Time>
<TimeTick>1463129866</TimeTick>
<NodeArgs eType="Replay" icon="9" nRep="36" >
<Disp><![CDATA[BTN_Log In.Click]]></Disp>
</NodeArgs>
</Step>
<NodeArgs eType="Context" icon="6" nRep="33" >
<Disp><![CDATA[Login]]></Disp>
</NodeArgs>
</Step>
<NodeArgs eType="Context" icon="5" nRep="32" >
<Disp><![CDATA[Login]]></Disp>
</NodeArgs>
</Step>
<Step rID="T24">
<Obj ><![CDATA[Login]]></Obj>
<Details ><![CDATA[]]></Details>
<Time><![CDATA[13-05-2016 - 14:27:46]]></Time>
<TimeTick>1463129866</TimeTick>
<NodeArgs eType="User" icon="7" nRep="37" status="Passed" >
<Disp><![CDATA[Login]]></Disp>
</NodeArgs>
</Step>
<Step rID="T25">
<Obj plainTxt="False" ><![CDATA[Work Queue]]></Obj>
<Details plainTxt="False" ><![CDATA[Browser]]></Details>
<Time><![CDATA[13-05-2016 - 14:27:48]]></Time>
<TimeTick>1463129868</TimeTick>
<Step rID="T26">
<Obj plainTxt="False" ><![CDATA[Work Queue]]></Obj>
<Details plainTxt="False" ><![CDATA[Page]]></Details>
<Time><![CDATA[13-05-2016 - 14:27:48]]></Time>
<TimeTick>1463129868</TimeTick>
<Step rID="T27">
<Obj plainTxt="False" ><![CDATA[TAB _Home.Exist]]></Obj>
<Details plainTxt="False" ><![CDATA["Object exists"]]></Details>
<Time><![CDATA[13-05-2016 - 14:27:48]]></Time>
<TimeTick>1463129868</TimeTick>
<NodeArgs eType="Replay" icon="10" nRep="41" >
<Disp><![CDATA[TAB _Home.Exist]]></Disp>
</NodeArgs>
</Step>
<Step rID="T28">
<Obj plainTxt="False" ><![CDATA[Work Queue.Sync]]></Obj>
<Details plainTxt="False" ><![CDATA[]]></Details>
<Time><![CDATA[13-05-2016 - 14:27:48]]></Time>
<TimeTick>1463129868</TimeTick>
<NodeArgs eType="Replay" icon="6" nRep="43" >
<Disp><![CDATA[Work Queue.Sync]]></Disp>
</NodeArgs>
</Step>
<Step rID="T29">
<Obj plainTxt="False" ><![CDATA[TAB _Home.Exist]]></Obj>
<Details plainTxt="False" ><![CDATA["Object exists"]]></Details>
<Time><![CDATA[13-05-2016 - 14:27:50]]></Time>
<TimeTick>1463129870</TimeTick>
<NodeArgs eType="Replay" icon="10" nRep="45" >
<Disp><![CDATA[TAB _Home.Exist]]></Disp>
</NodeArgs>
</Step>
<NodeArgs eType="Context" icon="6" nRep="40" >
<Disp><![CDATA[Work Queue]]></Disp>
</NodeArgs>
</Step>
<NodeArgs eType="Context" icon="5" nRep="39" >
<Disp><![CDATA[Work Queue]]></Disp>
</NodeArgs>
</Step>
<Step rID="T30">
<Obj ><![CDATA[Login]]></Obj>
<Details ><![CDATA[]]></Details>
<Time><![CDATA[13-05-2016 - 14:27:53]]></Time>
<TimeTick>1463129873</TimeTick>
<NodeArgs eType="User" icon="7" nRep="46" status="Passed" >
<Disp><![CDATA[Login]]></Disp>
</NodeArgs>
</Step>
<Step rID="T31">
<Obj plainTxt="False" ><![CDATA[Work Queue]]></Obj>
<Details plainTxt="False" ><![CDATA[Browser]]></Details>
<Time><![CDATA[13-05-2016 - 14:28:00]]></Time>
<TimeTick>1463129880</TimeTick>
<Step rID="T32">
<Obj plainTxt="False" ><![CDATA[Work Queue]]></Obj>
<Details plainTxt="False" ><![CDATA[Page]]></Details>
<Time><![CDATA[13-05-2016 - 14:28:00]]></Time>
<TimeTick>1463129880</TimeTick>
<Step rID="T33">
<Obj plainTxt="False" ><![CDATA[TAB_Tests.Exist]]></Obj>
<Details plainTxt="False" ><![CDATA["Object exists"]]></Details>
<Time><![CDATA[13-05-2016 - 14:28:00]]></Time>
<TimeTick>1463129880</TimeTick>
<NodeArgs eType="Replay" icon="10" nRep="50" >
<Disp><![CDATA[TAB_Tests.Exist]]></Disp>
</NodeArgs>
</Step>
<Step rID="T34">
<Obj plainTxt="False" ><![CDATA[TAB_Tests.Click]]></Obj>
<Details plainTxt="False" ><![CDATA[]]></Details>
<Time><![CDATA[13-05-2016 - 14:28:00]]></Time>
<TimeTick>1463129880</TimeTick>
<NodeArgs eType="Replay" icon="10" nRep="52" >
<Disp><![CDATA[TAB_Tests.Click]]></Disp>
</NodeArgs>
</Step>
<NodeArgs eType="Context" icon="6" nRep="49" >
<Disp><![CDATA[Work Queue]]></Disp>
</NodeArgs>
</Step>
<NodeArgs eType="Context" icon="5" nRep="48" >
<Disp><![CDATA[Work Queue]]></Disp>
</NodeArgs>
</Step>
<Step rID="T35">
<Obj ><![CDATA[NavigateToRepeatingRepeatModTable]]></Obj>
<Details ><![CDATA[]]></Details>
<Time><![CDATA[13-05-2016 - 14:28:00]]></Time>
<TimeTick>1463129880</TimeTick>
<NodeArgs eType="User" icon="7" nRep="53" status="Passed" >
<Disp><![CDATA[NavigateToRepeatingRepeatModTable]]></Disp>
</NodeArgs>
</Step>
<Step rID="T36">
<Obj plainTxt="False" ><![CDATA[Work Queue]]></Obj>
<Details plainTxt="False" ><![CDATA[Browser]]></Details>
<Time><![CDATA[13-05-2016 - 14:28:03]]></Time>
<TimeTick>1463129883</TimeTick>
<Step rID="T37">
<Obj plainTxt="False" ><![CDATA[Work Queue]]></Obj>
<Details plainTxt="False" ><![CDATA[Page]]></Details>
<Time><![CDATA[13-05-2016 - 14:28:03]]></Time>
<TimeTick>1463129883</TimeTick>
<Step rID="T38">
<Obj plainTxt="False" ><![CDATA[LNK_RepeatingModuleTable.Exist]]></Obj>
<Details plainTxt="False" ><![CDATA["Object exists"]]></Details>
<Time><![CDATA[13-05-2016 - 14:28:03]]></Time>
<TimeTick>1463129883</TimeTick>
<NodeArgs eType="Replay" icon="10" nRep="57" >
<Disp><![CDATA[LNK_RepeatingModuleTable.Exist]]></Disp>
</NodeArgs>
</Step>
<Step rID="T39">
<Obj plainTxt="False" ><![CDATA[LNK_RepeatingModuleTable.Click]]></Obj>
<Details plainTxt="False" ><![CDATA[]]></Details>
<Time><![CDATA[13-05-2016 - 14:28:03]]></Time>
<TimeTick>1463129883</TimeTick>
<NodeArgs eType="Replay" icon="10" nRep="59" >
<Disp><![CDATA[LNK_RepeatingModuleTable.Click]]></Disp>
</NodeArgs>
</Step>
<NodeArgs eType="Context" icon="6" nRep="56" >
<Disp><![CDATA[Work Queue]]></Disp>
</NodeArgs>
</Step>
<NodeArgs eType="Context" icon="5" nRep="55" >
<Disp><![CDATA[Work Queue]]></Disp>
</NodeArgs>
</Step>
<Step rID="T40">
<Obj ><![CDATA[NavigateToRepeatingRepeatModTable]]></Obj>
<Details ><![CDATA[]]></Details>
<Time><![CDATA[13-05-2016 - 14:28:03]]></Time>
<TimeTick>1463129883</TimeTick>
<NodeArgs eType="User" icon="7" nRep="60" status="Passed" >
<Disp><![CDATA[NavigateToRepeatingRepeatModTable]]></Disp>
</NodeArgs>
</Step>
<Step rID="T41">
<Obj plainTxt="False" ><![CDATA[Entry]]></Obj>
<Details plainTxt="False" ><![CDATA[Browser]]></Details>
<Time><![CDATA[13-05-2016 - 14:28:07]]></Time>
<TimeTick>1463129887</TimeTick>
<Step rID="T42">
<Obj plainTxt="False" ><![CDATA[Entry]]></Obj>
<Details plainTxt="False" ><![CDATA[Page]]></Details>
<Time><![CDATA[13-05-2016 - 14:28:07]]></Time>
<TimeTick>1463129887</TimeTick>
<Step rID="T43">
<Obj plainTxt="False" ><![CDATA[LBL_EnterAccountNumber.Exist]]></Obj>
<Details plainTxt="False" ><![CDATA["Object exists"]]></Details>
<Time><![CDATA[13-05-2016 - 14:28:07]]></Time>
<TimeTick>1463129887</TimeTick>
<NodeArgs eType="Replay" icon="10" nRep="64" >
<Disp><![CDATA[LBL_EnterAccountNumber.Exist]]></Disp>
</NodeArgs>
</Step>
<Step rID="T44">
<Obj plainTxt="False" ><![CDATA[Entry.Sync]]></Obj>
<Details plainTxt="False" ><![CDATA[]]></Details>
<Time><![CDATA[13-05-2016 - 14:28:07]]></Time>
<TimeTick>1463129887</TimeTick>
<NodeArgs eType="Replay" icon="6" nRep="66" >
<Disp><![CDATA[Entry.Sync]]></Disp>
</NodeArgs>
</Step>
<Step rID="T45">
<Obj plainTxt="False" ><![CDATA[LBL_EnterAccountNumber.Exist]]></Obj>
<Details plainTxt="False" ><![CDATA["Object exists"]]></Details>
<Time><![CDATA[13-05-2016 - 14:28:17]]></Time>
<TimeTick>1463129897</TimeTick>
<NodeArgs eType="Replay" icon="10" nRep="68" >
<Disp><![CDATA[LBL_EnterAccountNumber.Exist]]></Disp>
</NodeArgs>
</Step>
<NodeArgs eType="Context" icon="6" nRep="63" >
<Disp><![CDATA[Entry]]></Disp>
</NodeArgs>
</Step>
<NodeArgs eType="Context" icon="5" nRep="62" >
<Disp><![CDATA[Entry]]></Disp>
</NodeArgs>
</Step>
<Step rID="T46">
<Obj ><![CDATA[NavigateToRepeatingRepeatModTable]]></Obj>
<Details ><![CDATA[]]></Details>
<Time><![CDATA[13-05-2016 - 14:28:17]]></Time>
<TimeTick>1463129897</TimeTick>
<NodeArgs eType="User" icon="7" nRep="69" status="Passed" >
<Disp><![CDATA[NavigateToRepeatingRepeatModTable]]></Disp>
</NodeArgs>
</Step>
<Step rID="T47">
<Obj plainTxt="False" ><![CDATA[Entry]]></Obj>
<Details plainTxt="False" ><![CDATA[Browser]]></Details>
<Time><![CDATA[13-05-2016 - 14:28:23]]></Time>
<TimeTick>1463129903</TimeTick>
<Step rID="T48">
<Obj plainTxt="False" ><![CDATA[Entry]]></Obj>
<Details plainTxt="False" ><![CDATA[Page]]></Details>
<Time><![CDATA[13-05-2016 - 14:28:23]]></Time>
<TimeTick>1463129903</TimeTick>
<Step rID="T49">
<Obj plainTxt="False" ><![CDATA[LBL_EnterAccountNumber.Exist]]></Obj>
<Details plainTxt="False" ><![CDATA["Object exists"]]></Details>
<Time><![CDATA[13-05-2016 - 14:28:23]]></Time>
<TimeTick>1463129903</TimeTick>
<NodeArgs eType="Replay" icon="10" nRep="73" >
<Disp><![CDATA[LBL_EnterAccountNumber.Exist]]></Disp>
</NodeArgs>
</Step>
<NodeArgs eType="Context" icon="6" nRep="72" >
<Disp><![CDATA[Entry]]></Disp>
</NodeArgs>
</Step>
<NodeArgs eType="Context" icon="5" nRep="71" >
<Disp><![CDATA[Entry]]></Disp>
</NodeArgs>
</Step>
<Step rID="T50">
<Obj ><![CDATA[VerifyAddRowSubstringValidate]]></Obj>
<Details ><![CDATA[]]></Details>
<Time><![CDATA[13-05-2016 - 14:28:23]]></Time>
<TimeTick>1463129903</TimeTick>
<NodeArgs eType="User" icon="7" nRep="74" status="Passed" >
<Disp><![CDATA[VerifyAddRowSubstringValidate]]></Disp>
</NodeArgs>
</Step>
<Step rID="T51">
<Obj plainTxt="False" ><![CDATA[Entry]]></Obj>
<Details plainTxt="False" ><![CDATA[Browser]]></Details>
<Time><![CDATA[13-05-2016 - 14:28:27]]></Time>
<TimeTick>1463129907</TimeTick>
<Step rID="T52">
<Obj plainTxt="False" ><![CDATA[Entry]]></Obj>
<Details plainTxt="False" ><![CDATA[Page]]></Details>
<Time><![CDATA[13-05-2016 - 14:28:27]]></Time>
<TimeTick>1463129907</TimeTick>
<Step rID="T53">
<Obj plainTxt="False" ><![CDATA[TWL_AccountNumber.Exist]]></Obj>
<Details plainTxt="False" ><![CDATA["Object exists"]]></Details>
<Time><![CDATA[13-05-2016 - 14:28:27]]></Time>
<TimeTick>1463129907</TimeTick>
<NodeArgs eType="Replay" icon="10" nRep="78" >
<Disp><![CDATA[TWL_AccountNumber.Exist]]></Disp>
</NodeArgs>
</Step>
<NodeArgs eType="Context" icon="6" nRep="77" >
<Disp><![CDATA[Entry]]></Disp>
</NodeArgs>
</Step>
<NodeArgs eType="Context" icon="5" nRep="76" >
<Disp><![CDATA[Entry]]></Disp>
</NodeArgs>
</Step>
<Step rID="T54">
<Obj ><![CDATA[VerifyAddRowSubstringValidate]]></Obj>
<Details ><![CDATA[]]></Details>
<Time><![CDATA[13-05-2016 - 14:28:27]]></Time>
<TimeTick>1463129907</TimeTick>
<NodeArgs eType="User" icon="7" nRep="79" status="Passed" >
<Disp><![CDATA[VerifyAddRowSubstringValidate]]></Disp>
</NodeArgs>
</Step>
<Step rID="T55">
<Obj plainTxt="False" ><![CDATA[Entry]]></Obj>
<Details plainTxt="False" ><![CDATA[Browser]]></Details>
<Time><![CDATA[13-05-2016 - 14:28:32]]></Time>
<TimeTick>1463129912</TimeTick>
<Step rID="T56">
<Obj plainTxt="False" ><![CDATA[Entry]]></Obj>
<Details plainTxt="False" ><![CDATA[Page]]></Details>
<Time><![CDATA[13-05-2016 - 14:28:32]]></Time>
<TimeTick>1463129912</TimeTick>
<Step rID="T57">
<Obj plainTxt="False" ><![CDATA[TXT_AccountNumber.Exist]]></Obj>
<Details plainTxt="False" ><![CDATA["Object exists"]]></Details>
<Time><![CDATA[13-05-2016 - 14:28:32]]></Time>
<TimeTick>1463129912</TimeTick>
<NodeArgs eType="Replay" icon="8" nRep="83" >
<Disp><![CDATA[TXT_AccountNumber.Exist]]></Disp>
</NodeArgs>
</Step>
<NodeArgs eType="Context" icon="6" nRep="82" >
<Disp><![CDATA[Entry]]></Disp>
</NodeArgs>
</Step>
<NodeArgs eType="Context" icon="5" nRep="81" >
<Disp><![CDATA[Entry]]></Disp>
</NodeArgs>
</Step>
<Step rID="T58">
<Obj ><![CDATA[VerifyAddRowSubstringValidate]]></Obj>
<Details ><![CDATA[]]></Details>
<Time><![CDATA[13-05-2016 - 14:28:32]]></Time>
<TimeTick>1463129912</TimeTick>
<NodeArgs eType="User" icon="7" nRep="84" status="Passed" >
<Disp><![CDATA[VerifyAddRowSubstringValidate]]></Disp>
</NodeArgs>
</Step>
<Step rID="T59">
<Obj plainTxt="False" ><![CDATA[Entry]]></Obj>
<Details plainTxt="False" ><![CDATA[Browser]]></Details>
<Time><![CDATA[13-05-2016 - 14:28:36]]></Time>
<TimeTick>1463129916</TimeTick>
<Step rID="T60">
<Obj plainTxt="False" ><![CDATA[Entry]]></Obj>
<Details plainTxt="False" ><![CDATA[Page]]></Details>
<Time><![CDATA[13-05-2016 - 14:28:36]]></Time>
<TimeTick>1463129916</TimeTick>
<Step rID="T61">
<Obj plainTxt="False" ><![CDATA[TXT_AccountNumber.Exist]]></Obj>
<Details plainTxt="False" ><![CDATA["Object exists"]]></Details>
<Time><![CDATA[13-05-2016 - 14:28:36]]></Time>
<TimeTick>1463129916</TimeTick>
<NodeArgs eType="Replay" icon="8" nRep="88" >
<Disp><![CDATA[TXT_AccountNumber.Exist]]></Disp>
</NodeArgs>
</Step>
<Step rID="T62">
<Obj plainTxt="False" ><![CDATA[TXT_AccountNumber.Set]]></Obj>
<Details plainTxt="False" ><![CDATA["4000-0001"]]></Details>
<Time><![CDATA[13-05-2016 - 14:28:36]]></Time>
<TimeTick>1463129916</TimeTick>
<NodeArgs eType="Replay" icon="8" nRep="90" >
<Disp><![CDATA[TXT_AccountNumber.Set]]></Disp>
</NodeArgs>
</Step>
<NodeArgs eType="Context" icon="6" nRep="87" >
<Disp><![CDATA[Entry]]></Disp>
</NodeArgs>
</Step>
<NodeArgs eType="Context" icon="5" nRep="86" >
<Disp><![CDATA[Entry]]></Disp>
</NodeArgs>
</Step>
<Step rID="T63">
<Obj ><![CDATA[VerifyAddRowSubstringValidate]]></Obj>
<Details ><![CDATA[]]></Details>
<Time><![CDATA[13-05-2016 - 14:28:36]]></Time>
<TimeTick>1463129916</TimeTick>
<NodeArgs eType="User" icon="7" nRep="91" status="Passed" >
<Disp><![CDATA[VerifyAddRowSubstringValidate]]></Disp>
</NodeArgs>
</Step>
<Step rID="T64">
<Obj plainTxt="False" ><![CDATA[Entry]]></Obj>
<Details plainTxt="False" ><![CDATA[Browser]]></Details>
<Time><![CDATA[13-05-2016 - 14:28:39]]></Time>
<TimeTick>1463129919</TimeTick>
<Step rID="T65">
<Obj plainTxt="False" ><![CDATA[Entry]]></Obj>
<Details plainTxt="False" ><![CDATA[Page]]></Details>
<Time><![CDATA[13-05-2016 - 14:28:39]]></Time>
<TimeTick>1463129919</TimeTick>
<Step rID="T66">
<Obj plainTxt="False" ><![CDATA[BTN_NextRepeatingMod.Exist]]></Obj>
<Details plainTxt="False" ><![CDATA["Object exists"]]></Details>
<Time><![CDATA[13-05-2016 - 14:28:39]]></Time>
<TimeTick>1463129919</TimeTick>
<NodeArgs eType="Replay" icon="9" nRep="95" >
<Disp><![CDATA[BTN_NextRepeatingMod.Exist]]></Disp>
</NodeArgs>
</Step>
<NodeArgs eType="Context" icon="6" nRep="94" >
<Disp><![CDATA[Entry]]></Disp>
</NodeArgs>
</Step>
<NodeArgs eType="Context" icon="5" nRep="93" >
<Disp><![CDATA[Entry]]></Disp>
</NodeArgs>
</Step>
<Step rID="T67">
<Obj ><![CDATA[VerifyAddRowSubstringValidate]]></Obj>
<Details ><![CDATA[]]></Details>
<Time><![CDATA[13-05-2016 - 14:28:39]]></Time>
<TimeTick>1463129919</TimeTick>
<NodeArgs eType="User" icon="7" nRep="96" status="Passed" >
<Disp><![CDATA[VerifyAddRowSubstringValidate]]></Disp>
</NodeArgs>
</Step>
<Step rID="T68">
<Obj plainTxt="False" ><![CDATA[Entry]]></Obj>
<Details plainTxt="False" ><![CDATA[Browser]]></Details>
<Time><![CDATA[13-05-2016 - 14:28:43]]></Time>
<TimeTick>1463129923</TimeTick>
<Step rID="T69">
<Obj plainTxt="False" ><![CDATA[Entry]]></Obj>
<Details plainTxt="False" ><![CDATA[Page]]></Details>
<Time><![CDATA[13-05-2016 - 14:28:43]]></Time>
<TimeTick>1463129923</TimeTick>
<Step rID="T70">
<Obj plainTxt="False" ><![CDATA[BTN_NextRepeatingMod.Exist]]></Obj>
<Details plainTxt="False" ><![CDATA["Object exists"]]></Details>
<Time><![CDATA[13-05-2016 - 14:28:43]]></Time>
<TimeTick>1463129923</TimeTick>
<NodeArgs eType="Replay" icon="9" nRep="100" >
<Disp><![CDATA[BTN_NextRepeatingMod.Exist]]></Disp>
</NodeArgs>
</Step>
<Step rID="T71">
<Obj plainTxt="False" ><![CDATA[BTN_NextRepeatingMod.Click]]></Obj>
<Details plainTxt="False" ><![CDATA[]]></Details>
<Time><![CDATA[13-05-2016 - 14:28:43]]></Time>
<TimeTick>1463129923</TimeTick>
<NodeArgs eType="Replay" icon="9" nRep="102" >
<Disp><![CDATA[BTN_NextRepeatingMod.Click]]></Disp>
</NodeArgs>
</Step>
<NodeArgs eType="Context" icon="6" nRep="99" >
<Disp><![CDATA[Entry]]></Disp>
</NodeArgs>
</Step>
<NodeArgs eType="Context" icon="5" nRep="98" >
<Disp><![CDATA[Entry]]></Disp>
</NodeArgs>
</Step>
<Step rID="T72">
<Obj ><![CDATA[VerifyAddRowSubstringValidate]]></Obj>
<Details ><![CDATA[]]></Details>
<Time><![CDATA[13-05-2016 - 14:28:44]]></Time>
<TimeTick>1463129924</TimeTick>
<NodeArgs eType="User" icon="7" nRep="103" status="Passed" >
<Disp><![CDATA[VerifyAddRowSubstringValidate]]></Disp>
</NodeArgs>
</Step>
<Step rID="T73">
<Obj plainTxt="False" ><![CDATA[Run Rules for Table]]></Obj>
<Details plainTxt="False" ><![CDATA[Browser]]></Details>
<Time><![CDATA[13-05-2016 - 14:28:48]]></Time>
<TimeTick>1463129928</TimeTick>
<Step rID="T74">
<Obj plainTxt="False" ><![CDATA[Run Rules for Table]]></Obj>
<Details plainTxt="False" ><![CDATA[Page]]></Details>
<Time><![CDATA[13-05-2016 - 14:28:48]]></Time>
<TimeTick>1463129928</TimeTick>
<Step rID="T75">
<Obj plainTxt="False" ><![CDATA[TBL_RepeatingModuleDataTable.Exist]]></Obj>
<Details plainTxt="False" ><![CDATA["Object exists"]]></Details>
<Time><![CDATA[13-05-2016 - 14:28:48]]></Time>
<TimeTick>1463129928</TimeTick>
<NodeArgs eType="Replay" icon="11" nRep="107" >
<Disp><![CDATA[TBL_RepeatingModuleDataTable.Exist]]></Disp>
</NodeArgs>
</Step>
<NodeArgs eType="Context" icon="6" nRep="106" >
<Disp><![CDATA[Run Rules for Table]]></Disp>
</NodeArgs>
</Step>
<NodeArgs eType="Context" icon="5" nRep="105" >
<Disp><![CDATA[Run Rules for Table]]></Disp>
</NodeArgs>
</Step>
<Step rID="T76">
<Obj ><![CDATA[VerifyAddRowSubstringValidate]]></Obj>
<Details ><![CDATA[]]></Details>
<Time><![CDATA[13-05-2016 - 14:28:51]]></Time>
<TimeTick>1463129931</TimeTick>
<NodeArgs eType="User" icon="7" nRep="108" status="Passed" >
<Disp><![CDATA[VerifyAddRowSubstringValidate]]></Disp>
</NodeArgs>
</Step>
<Step rID="T77">
<Obj plainTxt="False" ><![CDATA[Run Rules for Table]]></Obj>
<Details plainTxt="False" ><![CDATA[Browser]]></Details>
<Time><![CDATA[13-05-2016 - 14:28:54]]></Time>
<TimeTick>1463129934</TimeTick>
<Step rID="T78">
<Obj plainTxt="False" ><![CDATA[Run Rules for Table]]></Obj>
<Details plainTxt="False" ><![CDATA[Page]]></Details>
<Time><![CDATA[13-05-2016 - 14:28:54]]></Time>
<TimeTick>1463129934</TimeTick>
<Step rID="T79">
<Obj plainTxt="False" ><![CDATA[TBL_RepeatingModuleDataTable.Exist]]></Obj>
<Details plainTxt="False" ><![CDATA["Object exists"]]></Details>
<Time><![CDATA[13-05-2016 - 14:28:54]]></Time>
<TimeTick>1463129934</TimeTick>
<NodeArgs eType="Replay" icon="11" nRep="112" >
<Disp><![CDATA[TBL_RepeatingModuleDataTable.Exist]]></Disp>
</NodeArgs>
</Step>
<NodeArgs eType="Context" icon="6" nRep="111" >
<Disp><![CDATA[Run Rules for Table]]></Disp>
</NodeArgs>
</Step>
<NodeArgs eType="Context" icon="5" nRep="110" >
<Disp><![CDATA[Run Rules for Table]]></Disp>
</NodeArgs>
</Step>
<Step rID="T80">
<Obj ><![CDATA[VerifyAddRowSubstringValidate]]></Obj>
<Details ><![CDATA[]]></Details>
<Time><![CDATA[13-05-2016 - 14:28:54]]></Time>
<TimeTick>1463129934</TimeTick>
<NodeArgs eType="User" icon="7" nRep="113" status="Passed" >
<Disp><![CDATA[VerifyAddRowSubstringValidate]]></Disp>
</NodeArgs>
</Step>
<Step rID="T81">
<Obj plainTxt="False" ><![CDATA[Run Rules for Table]]></Obj>
<Details plainTxt="False" ><![CDATA[Browser]]></Details>
<Time><![CDATA[13-05-2016 - 14:28:55]]></Time>
<TimeTick>1463129935</TimeTick>